{
  "$schema": "https://json-schema.org/draft/2020-12/schema",
  "$id": "https://github.com/OussemaHarrabi/SpectraQuant/artifacts/schemas/run-manifest.schema.json",
  "title": "SpectraQuant run manifest",
  "description": "Machine-readable record of one executed run. Every field is either measured or explicitly null; no field may be filled with an estimate. measurement_class labels the reported numbers per AGENTS.md section 5 and is null only for runs that declare no compression (method=\"none\").",
  "type": "object",
  "additionalProperties": false,
  "required": [
    "schema_version",
    "run_id",
    "timestamp_utc",
    "git_commit",
    "git_dirty",
    "config_path",
    "resolved_config",
    "model_id",
    "model_revision",
    "dataset_ids",
    "dataset_revisions",
    "dataset_checksums",
    "split",
    "seed",
    "hardware",
    "software",
    "compression",
    "theoretical_bits",
    "packed_bytes",
    "runtime_backend",
    "measurement_class",
    "training",
    "metrics",
    "status",
    "failure_reason",
    "log_path",
    "artifact_paths"
  ],
  "properties": {
    "schema_version": {
      "description": "Manifest schema revision this document validates against.",
      "const": 1
    },
    "run_id": {
      "description": "Unique, filesystem-safe identifier of this run.",
      "type": "string",
      "minLength": 1,
      "maxLength": 128,
      "pattern": "^[A-Za-z0-9][A-Za-z0-9._-]*$"
    },
    "timestamp_utc": {
      "description": "UTC start time, ISO 8601 with a Z suffix.",
      "type": "string",
      "format": "date-time",
      "pattern": "^\\d{4}-\\d{2}-\\d{2}T\\d{2}:\\d{2}:\\d{2}(\\.\\d+)?Z$"
    },
    "git_commit": {
      "description": "Full 40-character SHA of HEAD, or null when not inside a git checkout.",
      "type": ["string", "null"],
      "pattern": "^[0-9a-f]{40}$"
    },
    "git_dirty": {
      "description": "True when the working tree had uncommitted tracked changes; null when unknown.",
      "type": ["boolean", "null"]
    },
    "config_path": {
      "description": "Absolute path of the experiment config that was composed.",
      "type": "string",
      "minLength": 1
    },
    "resolved_config": {
      "description": "Fully resolved Hydra config (all defaults merged, all interpolations resolved).",
      "type": "object"
    },
    "model_id": {
      "description": "Model identifier, e.g. an HF repo id; null for locally defined models.",
      "type": ["string", "null"]
    },
    "model_revision": {
      "description": "Immutable model revision (commit/tag) or a content hash for local models.",
      "type": ["string", "null"]
    },
    "dataset_ids": {
      "description": "Identifiers of every dataset used.",
      "type": "array",
      "items": { "type": "string", "minLength": 1 }
    },
    "dataset_revisions": {
      "description": "Revision per dataset, parallel to dataset_ids.",
      "type": "array",
      "items": { "type": ["string", "null"] }
    },
    "dataset_checksums": {
      "description": "Content checksums, parallel to dataset_ids. Format: sha256:<64 hex>.",
      "type": "array",
      "items": { "type": "string", "pattern": "^(sha256:)?[0-9a-f]{64}$" }
    },
    "split": {
      "description": "Split the reported metrics come from (train/val/test/...).",
      "type": "string",
      "minLength": 1
    },
    "seed": {
      "description": "Master seed passed to the deterministic seeding routine.",
      "type": "integer",
      "minimum": 0
    },
    "hardware": {
      "type": "object",
      "additionalProperties": false,
      "required": [
        "platform",
        "system",
        "release",
        "machine",
        "processor",
        "cpu_count_logical",
        "ram_total_mb",
        "gpu_available",
        "gpu_devices",
        "torch_device",
        "torch_threads"
      ],
      "properties": {
        "platform": { "type": "string" },
        "system": { "type": "string" },
        "release": { "type": "string" },
        "machine": { "type": "string" },
        "processor": { "type": ["string", "null"] },
        "cpu_count_logical": { "type": ["integer", "null"], "minimum": 1 },
        "ram_total_mb": { "type": ["number", "null"], "minimum": 0 },
        "gpu_available": { "type": "boolean" },
        "gpu_devices": { "type": "array", "items": { "type": "string" } },
        "torch_device": { "type": "string" },
        "torch_threads": { "type": "integer", "minimum": 1 }
      }
    },
    "software": {
      "description": "Version per dependency; null means the distribution is not installed.",
      "type": "object",
      "additionalProperties": { "type": ["string", "null"] }
    },
    "compression": {
      "description": "Compression actually applied. method=\"none\" means an uncompressed baseline. The byte fields (accounted_bytes, measured_bytes, serializer, nominal/measured_bits_per_param, bytes_source) exist so two arms can be gated at equal memory: see src/spectraquant/reporting/comparability.py and AGENTS.md section 4.5.",
      "type": "object",
      "additionalProperties": false,
      "required": ["method", "ranks", "bits", "group_size", "exclusions"],
      "properties": {
        "method": {
          "type": "string",
          "enum": [
            "none",
            "rtn",
            "gptq",
            "awq",
            "smoothquant",
            "llm-int8",
            "lr-qat",
            "loftq",
            "lq-lora",
            "svd",
            "spectraquant"
          ]
        },
        "ranks": {
          "description": "Per-layer or global rank budget; null when not applicable.",
          "type": ["array", "null"],
          "items": { "type": "integer", "minimum": 1 }
        },
        "bits": {
          "description": "Target bit width; null when not applicable.",
          "type": ["integer", "null"],
          "enum": [2, 3, 4, 8, 16, 32, null]
        },
        "group_size": {
          "description": "Quantization group size; null when not applicable.",
          "type": ["integer", "null"],
          "minimum": 1
        },
        "exclusions": {
          "description": "Layers/patterns excluded from compression.",
          "type": "array",
          "items": { "type": "string" }
        },
        "accounted_bytes": {
          "description": "Analytical (class 1) stored size in bytes implied by the compression plan, including scales, zero points, group metadata, padding and alignment (AGENTS.md section 5). Defined per (shape, spec) pair, so a model-level value MUST be the sum over layers. It MUST NOT be reported as measured bytes (AGENTS.md section 4.13; docs/protocols/memory-accounting.md section 6). Null when no plan was costed.",
          "type": ["integer", "null"],
          "minimum": 0
        },
        "measured_bytes": {
          "description": "Measured (class 3) serialized size in bytes of the compressed weights as written by compression.serializer. Null when nothing was serialized.",
          "type": ["integer", "null"],
          "minimum": 0
        },
        "measured_bytes_tolerance": {
          "description": "Predeclared equal-memory tolerance for this arm: either an absolute byte count (integer >= 0) or a relative fraction (a number strictly between 0 and 1) of the larger of the two compared byte totals. Integer values are always absolute bytes; null when this arm declares no tolerance.",
          "oneOf": [
            { "type": "integer", "minimum": 0 },
            { "type": "number", "exclusiveMinimum": 0.0, "exclusiveMaximum": 1.0 },
            { "type": "null" }
          ]
        },
        "serializer": {
          "description": "Frozen serializer invocation identifier that produced measured_bytes. For SpectraQuant's own container this is spectraquant.quantization.SQ_CONTAINER_FORMAT_ID (e.g. \"spectraquant-sqpack-v1\"), optionally suffixed with the invocation parameters when the byte layout depends on them. Two class-3 byte counts are only comparable when the same frozen invocation produced them; required whenever measured_bytes is reported.",
          "type": ["string", "null"],
          "minLength": 1
        },
        "nominal_bits_per_param": {
          "description": "Analytical (class 1) bits per parameter of the compression plan; null when not applicable. Ideal payload only, excluding scales, zero points, padding and container overhead, so it is a LOWER BOUND and not a storage figure. The memory-model counterpart is 8*accounted_bytes/numel; compression.measured_bits_per_param is 8*measured_bytes/numel and is class 3. Never present one under the other's name (AGENTS.md section 4.13).",
          "type": ["number", "null"],
          "minimum": 0
        },
        "measured_bits_per_param": {
          "description": "Measured (class 3) bits per parameter, i.e. 8 * measured_bytes / parameter_count of the compressed tensors; null when nothing was serialized.",
          "type": ["number", "null"],
          "minimum": 0
        },
        "bytes_source": {
          "description": "Which byte figure this run declares as its comparable memory. \"measured\" = class-3 measured_bytes (requires a non-null measured_bytes and serializer); \"accounted\" = class-1 accounted_bytes and is only allowed when measured_bytes is null, so a class-3 measurement can never be silently downgraded to the estimate.",
          "enum": ["accounted", "measured", null]
        }
      }
    },
    "theoretical_bits": {
      "description": "Analytical (class 1) bits per parameter implied by the compression plan; null when no plan exists. Payload only, excluding scales, zero points, padding and container overhead: a LOWER BOUND, never a storage figure, and never to be quoted as measured (AGENTS.md section 4.13; docs/protocols/memory-accounting.md section 6).",
      "type": ["number", "null"],
      "minimum": 0
    },
    "packed_bytes": {
      "description": "Measured (class 3) serialized size of the compressed weights; null when nothing was serialized.",
      "type": ["integer", "null"],
      "minimum": 0
    },
    "runtime_backend": {
      "description": "Execution backend that produced the metrics. CUDA backends are never reported from this workstation.",
      "type": "string",
      "enum": [
        "torch-cpu-fp32",
        "torch-cpu-fp16",
        "torch-cpu-bf16",
        "torch-cuda-fp16",
        "torch-cuda-bf16",
        "not-applicable"
      ]
    },
    "measurement_class": {
      "description": "1-5 per AGENTS.md section 5; null only when compression.method == \"none\".",
      "oneOf": [{ "type": "integer", "minimum": 1, "maximum": 5 }, { "type": "null" }]
    },
    "training": {
      "type": "object",
      "additionalProperties": false,
      "required": ["steps", "tokens", "wall_time_s", "peak_mem_mb"],
      "properties": {
        "steps": { "type": "integer", "minimum": 0 },
        "tokens": { "type": "integer", "minimum": 0 },
        "wall_time_s": { "type": "number", "minimum": 0 },
        "peak_mem_mb": {
          "description": "Peak process resident memory during the run, MiB (null if unmeasurable).",
          "type": ["number", "null"],
          "minimum": 0
        }
      }
    },
    "metrics": {
      "description": "Measured metrics. Numbers must carry the measurement_class of this manifest.",
      "type": "object",
      "additionalProperties": {
        "type": ["number", "string", "boolean", "null", "array"]
      }
    },
    "status": {
      "description": "Outcome of the run. \"success\" = every declared cell completed. \"partial\" = the wall-clock deadline stopped the run at a work boundary; the metrics record which cells completed, which did not and why it stopped (run.partial/run.cells_completed/run.cells_not_completed/run.stop_reason), and failure_reason is required, so a partial run can never be read as a complete one. \"failed\"/\"aborted\" = the run died.",
      "type": "string",
      "enum": ["success", "partial", "failed", "aborted"]
    },
    "failure_reason": {
      "description": "Non-null exactly when status != \"success\": why a failed/aborted run died, or the wall-clock deadline that stopped a partial run.",
      "type": ["string", "null"]
    },
    "log_path": {
      "description": "Path to the captured run log, or null when the run was not logged to a file.",
      "type": ["string", "null"]
    },
    "artifact_paths": {
      "description": "Paths of artifacts written by the run (checkpoints, tables, figures).",
      "type": "array",
      "items": { "type": "string" }
    }
  },
  "allOf": [
    {
      "description": "A partial run must name what stopped it, so it is never mistaken for a complete one.",
      "if": {
        "properties": { "status": { "const": "partial" } },
        "required": ["status"]
      },
      "then": {
        "properties": { "failure_reason": { "type": "string", "minLength": 1 } }
      }
    }
  ]
}
