{
  "artifact_paths": [],
  "compression": {
    "bits": null,
    "exclusions": [],
    "group_size": null,
    "method": "none",
    "ranks": null
  },
  "config_path": "C:\\Users\\oussa\\oussema\\SpectraQuant\\configs\\experiment\\smoke.yaml",
  "dataset_checksums": [
    "sha256:80ad98a4ed732d755a09008ab447e7716b975bfb062580116128bc8b3e672887"
  ],
  "dataset_ids": [
    "synthetic-lcg-v1"
  ],
  "dataset_revisions": [
    null
  ],
  "failure_reason": null,
  "git_commit": "f77fc9a5199dce53dbaa9347e3da48918715c5aa",
  "git_dirty": true,
  "hardware": {
    "cpu_count_logical": 16,
    "gpu_available": false,
    "gpu_devices": [],
    "machine": "AMD64",
    "platform": "Windows-10-10.0.26200-SP0",
    "processor": "AMD64 Family 26 Model 96 Stepping 0, AuthenticAMD",
    "ram_total_mb": 15481.86328125,
    "release": "10",
    "system": "Windows",
    "torch_device": "cpu",
    "torch_threads": 1
  },
  "log_path": null,
  "measurement_class": null,
  "metrics": {
    "batch_size": 16,
    "learning_rate": 0.003,
    "loss_sequence": [
      3.703542233,
      3.345354557,
      2.959862471,
      2.671277285,
      2.343989849,
      2.019166231,
      1.766265869,
      1.479928374,
      1.259962559,
      1.053175688,
      0.919347942,
      0.755051255,
      0.635038733,
      0.54359746,
      0.439971089,
      0.376603186,
      0.327985346,
      0.273838639,
      0.237010852,
      0.205904931,
      0.175129548,
      0.152532518,
      0.132180676,
      0.115508825,
      0.102057599,
      0.08927957,
      0.080038212,
      0.072805151,
      0.064216465,
      0.057975106,
      0.05455967,
      0.04993647,
      0.043625377,
      0.040270343,
      0.038814746,
      0.035716254,
      0.032852303,
      0.029497851,
      0.028905738,
      0.026899861,
      0.024690086,
      0.023362875,
      0.021317042,
      0.021288849,
      0.020302227,
      0.019468723,
      0.018138511,
      0.017344167,
      0.017794285,
      0.016445234
    ],
    "loss_sequence_sha256": "sha256:1b2e0622416a86a7abba19042c41318b555fa84907659406775a51dfc87448ca",
    "parameter_count": 106240,
    "seq_len": 32,
    "steps": 50,
    "train_loss_final": 0.016445234,
    "train_loss_initial": 3.703542233,
    "train_loss_reduction": 3.687096998,
    "uniform_prior_entropy": 3.465735912,
    "val_loss": 0.018675709
  },
  "model_id": null,
  "model_revision": "sha256:fcf326c7dbf10c3a130c228d903969a40ce2c742bc54faa669fcda8e1a922abb",
  "packed_bytes": null,
  "resolved_config": {
    "data": {
      "generator": "lcg",
      "kind": "synthetic",
      "lcg_a": 3,
      "lcg_b": 7,
      "n_train_sequences": 24,
      "n_val_sequences": 8,
      "name": "synthetic-lcg-v1",
      "seq_len": 32,
      "train_start": 0,
      "val_start": 24,
      "vocab_size": 32
    },
    "experiment": {
      "name": "smoke",
      "output": {
        "filename": "smoke-manifest.json",
        "results_dir": "artifacts/sample-results"
      },
      "seed": 1234,
      "training": {
        "batch_size": 16,
        "grad_clip": 1.0,
        "log_every": 10,
        "lr": 0.003,
        "steps": 50,
        "weight_decay": 0.0
      }
    },
    "method": {
      "compression": {
        "bits": null,
        "exclusions": [],
        "group_size": null,
        "method": "none",
        "ranks": null
      },
      "kind": "none",
      "measurement_class": null,
      "name": "none"
    },
    "model": {
      "d_model": 64,
      "dropout": 0.0,
      "max_seq_len": 32,
      "n_heads": 4,
      "n_layers": 2,
      "name": "tiny-char-transformer",
      "vocab_size": 32
    }
  },
  "run_id": "smoke-20261008T204324Z-f77fc9a5199d-db7736",
  "runtime_backend": "torch-cpu-fp32",
  "schema_version": 1,
  "seed": 1234,
  "software": {
    "hydra-core": "1.3.7",
    "jsonschema": "4.26.0",
    "mlflow-skinny": "3.17.0",
    "numpy": "2.4.6",
    "omegaconf": "2.3.1",
    "operator_system": "Windows",
    "pydantic": "2.14.0",
    "python": "3.11.16",
    "python_implementation": "CPython",
    "rich": "15.0.0",
    "spectraquant": "0.1.0.dev0",
    "torch": "2.14.1+cpu",
    "torch_cuda_build": null,
    "torch_hip_build": null,
    "typer": "0.27.3"
  },
  "split": "train",
  "status": "success",
  "theoretical_bits": null,
  "timestamp_utc": "2026-10-08T20:43:24Z",
  "training": {
    "peak_mem_mb": 304.34,
    "steps": 50,
    "tokens": 25600,
    "wall_time_s": 0.631887
  }
}
